reportID,speed,crashwith,svhit,cphit,severity,faultfrac,reasoning
30610-13662,0,Heavy Truck,front left+front right,rear+rear right,no injury/property damage,0.00,Truck reversed into stopped AV
30610-13661,1,Pickup Truck,rear left+rear right,front+front right,no injury/property damage,0.00,AV braked for debris and was rear-ended by merging pickup
30610-13660,1,Passenger Car,front,rear left,no injury/property damage,0.05,Other cars made illegal right turn across AV path
30270-13511,0,Van,rear,right,no injury/property damage,0.05,Passing van struck stationary AV during overtake
30270-13308,35,Pickup Truck,rear,front left,no injury/property damage,0.05,Pickup changed back into AV lane while passing
30270-13557,0,Heavy Truck,front right,rear right,no injury/property damage,0.00,Heavy truck reversed into stationary AV
30270-13549,0,SUV,rear right,front right,no injury/property damage,0.00,SUV rear-ended stationary AV at red light
30270-13554,0,Heavy Truck,rear right,front right,no injury/property damage,0.00,Heavy truck rolled forward into stationary AV
30270-13564,0,Non-Motorist: Scooter - Skateboard,rear left,unknown,no injury/property damage,0.00,Scooter struck AV while AV was stopped yielding to pedestrians
30270-13548,12,Heavy Truck,rear,front left,no injury/property damage,0.10,Box truck crossed solid line into AV turn path
30270-13515,0,Passenger Car,front right,rear right,no injury/property damage,0.00,Vehicle ahead reversed into stationary AV
30270-13510,15,Passenger Car,rear left,front,no injury/property damage,0.50,Both vehicles changed lanes into each other
30270-13453,0,Bus,front right,rear right,no injury/property damage,0.00,Bus reversed into stationary AV
30270-13450,0,SUV,rear,right,no injury/property damage,0.00,Passing SUV sideswiped parked AV
30270-13451,0,Pickup Truck,rear,rear,no injury/property damage,0.00,Passing pickup struck stationary AV on narrow street
30270-13420,1,SUV,rear right,front right,no injury/property damage,0.05,SUV from behind struck AV after stop-sign slowdown
30270-13410,0,Pickup Truck,front right,rear,no injury/property damage,0.00,Pickup reversing to park struck stationary AV
30270-13448,0,Van,front,rear,no injury/property damage,0.00,Van reversed into stationary AV
30270-13403,13,SUV,front,front left,no injury/property damage,0.10,Other SUV crossed dashed line during parallel left turn
30270-13405,12,Passenger Car,rear left,front,no injury/property damage,0.15,Counterpart went straight from right-turn-only lane
30270-13409,20,SUV,rear,front left,no injury/property damage,0.10,Other SUV crossed dashed line during parallel left turn
30270-13395,0,Passenger Car,rear right,front right,no injury/property damage,0.00,Passenger car rear-ended stationary AV
30270-13454,3,"Other, see Narrative",front,right,no injury/property damage,1.00,AV moved left to merge while cable car was passing
30270-13340,0,Pickup Truck,rear left,rear,no injury/property damage,0.00,Pickup reversed from driveway into stationary AV
30270-13307,9,Pickup Truck,front,front left,no injury/property damage,0.10,Pickup turned across AV curbside right-turn path
30270-13489,1,Heavy Truck,front right,rear right,no injury/property damage,0.20,Truck continued reversing into AV despite AV reverse attempt
30270-13401,0,Passenger Car,front right,rear right,no injury/property damage,0.00,Vehicle ahead reversed into stationary AV
30270-13400,0,Passenger Car,rear,left,no injury/property damage,0.00,Oncoming car passing left struck stationary AV
30270-13408,0,Passenger Car,rear,right,no injury/property damage,0.00,Car changing lanes to pass struck stationary AV
30270-13416,0,Passenger Car,rear right,front right,no injury/property damage,0.00,Passenger car rear-ended stationary AV
30270-13331,0,SUV,rear right,front right,no injury/property damage,0.00,SUV rear-ended stationary AV at flashing red
30270-13361,0,Heavy Truck,rear,front,no injury/property damage,0.00,Turning heavy truck crossed centerline into stationary AV
30270-13327,0,Heavy Truck,front right,rear right,no injury/property damage,0.00,Heavy truck trailer reversed into stationary AV
30270-13309,0,Passenger Car,rear,front left,no injury/property damage,0.00,Passing car hit parked AV during maneuver-around
30270-13323,0,SUV,front,rear left,no injury/property damage,0.00,SUV reversed into stationary AV
30270-13322,0,Motorcycle,left,front right,no injury/property damage,0.00,E-bike entered stop-controlled intersection and hit stationary AV
30270-13321,0,Motorcycle,right,front,no injury/property damage,0.00,AV passenger door opening contributed to motorcycle contact
30270-13279,0,Passenger Car,rear right,front right,no injury/property damage,0.00,Passenger car rear-ended stationary AV in queue
30270-13445,0,Passenger Car,front right,rear right,no injury/property damage,0.00,Parallel-parking car reversed into parked AV
13781-13647,17,Other Fixed Object,bottom,unknown,no injury/property damage,0.90,Redacted narrative and crash with fixed object while AV proceeding
13781-13648,0,Bus,left+front,front right,no injury/property damage,0.10,Redacted narrative with AV stopped and counterpart turning right
13781-13646,2,Other Fixed Object,bottom,unknown,no injury/property damage,0.95,Redacted narrative and AV backing into fixed object class
13781-13645,1,Pole / Tree,rear right,unknown,no injury/property damage,1.00,Redacted narrative and AV backing into pole/tree
13781-13644,4,Heavy Truck,left,rear,no injury/property damage,0.90,Redacted narrative with counterpart parked and AV proceeding
30270-13607,20,"Other, see Narrative",front right,unknown,no injury/property damage,0.05,Traffic cone was thrown into AV lane by another vehicle occupant
30270-13586,17,Passenger Car,left,front right,no injury/property damage,0.05,Passenger car ran stop sign and entered AV path
30270-13585,0,SUV,front left,front,minor injury (hosp.),0.00,Stationary AV struck via chain-reaction collision
30270-13583,10,Other Fixed Object,bottom,unknown,no injury/property damage,0.90,AV undercarriage struck raised pavement in travel lane
30270-13581,0,Heavy Truck,rear,right,no injury/property damage,0.00,Passing heavy truck sideswiped stationary AV
30270-13582,11,Passenger Car,rear left,front left,no injury/property damage,0.10,Passenger car ran stop sign and struck AV rear quarter
30270-13575,4,Passenger Car,front,front left,no injury/property damage,0.05,Counterpart lost traction and crossed into AV lane
30270-13573,0,Passenger Car,rear right,front right,no injury/property damage,0.05,Stationary AV struck by moving counterpart
30270-13571,0,Van,rear,right,no injury/property damage,0.05,Stationary AV struck by moving counterpart
30270-13560,0,Passenger Car,rear right,front right,no injury/property damage,0.05,Stationary AV struck by moving counterpart
30270-13559,5,Other Fixed Object,bottom,unknown,no injury/property damage,0.90,AV contacted fixed roadway/object hazard
30270-13556,0,Pickup Truck,rear,front,no injury/property damage,0.05,Stationary AV struck by moving counterpart
30270-13552,20,"Other, see Narrative",bottom,unknown,no injury/property damage,0.90,AV contacted fixed roadway/object hazard
30270-13550,0,SUV,rear right,front right,minor injury (hosp.),0.00,Stationary AV struck after trailing SUV was rear-ended
30270-13558,2,Passenger Car,rear right,front right,no injury/property damage,0.10,Following car struck AV from behind during unprotected-left yield
30270-13547,0,Passenger Car,rear right,front right,no injury/property damage,0.05,Stationary AV struck by moving counterpart
30270-13545,0,SUV,rear right,front right,minor injury (hosp.),0.00,Counterpart failed to yield to stationary AV
30270-13546,28,Passenger Car,right,front,no injury/property damage,0.10,Counterpart right turn crossed AV path
30270-13544,0,SUV,rear,right,no injury/property damage,0.05,Stationary AV struck by moving counterpart
30270-13543,0,Passenger Car,rear left,front,minor injury (hosp.),0.05,Stationary AV struck by moving counterpart
30270-13542,0,Heavy Truck,right,rear,no injury/property damage,0.00,Counterpart backed into stationary AV
30270-13541,0,Pickup Truck,front,front left,no injury/property damage,0.35,AV stopped partially across lane during lane-change attempt
30270-13540,0,Pickup Truck,rear left,right,no injury/property damage,0.05,Stationary AV struck by moving counterpart
30270-13539,0,First Responder Vehicle,rear,left,no injury/property damage,0.05,Counterpart maneuvered into stationary AV
30270-13538,0,Passenger Car,left,right,no injury/property damage,0.00,Open AV passenger door was struck by passing car
30270-13514,25,Other Fixed Object,front right,unknown,no injury/property damage,0.25,AV contacted fallen utility line hanging in lane
30270-13513,0,Heavy Truck,front,rear left,no injury/property damage,0.00,Counterpart backed into stationary AV
30270-13512,0,Heavy Truck,rear,left,no injury/property damage,0.00,Passing heavy truck struck stationary AV on narrow street
30270-13507,0,Heavy Truck,front,right,no injury/property damage,0.05,Counterpart maneuvered into stationary AV
30270-13495,0,SUV,rear right,front right,minor injury (hosp.),0.05,Stationary AV struck by moving counterpart
30270-13491,0,Van,rear right,front right,minor injury (hosp.),0.05,Stationary AV struck by moving counterpart
30270-13490,9,SUV,rear right,front right,minor injury (hosp.),0.05,SUV struck AV from behind while AV was slowing for flashing red
30270-13506,25,"Other, see Narrative",front,unknown,no injury/property damage,0.35,AV tire contacted roadway debris in travel lane
30270-13509,18,Other Fixed Object,front right,unknown,no injury/property damage,0.25,AV contacted fallen utility line in travel lane
30270-13488,22,Passenger Car,right,front right,minor injury (hosp.),0.10,Cross-traffic vehicle entered intersection and struck AV side
30270-13487,10,Other Fixed Object,bottom,unknown,no injury/property damage,0.90,AV contacted fixed roadway/object hazard
30270-13486,0,Passenger Car,rear right,front right,no injury/property damage,0.00,AV stopped and was rear-ended by following car
30270-13485,10,Other Fixed Object,bottom,unknown,no injury/property damage,0.90,AV contacted fixed roadway/object hazard
30270-13484,22,SUV,rear left,front,no injury/property damage,0.05,Counterpart turned right from stop-controlled approach into AV path
30270-13467,9,"Other, see Narrative",bottom,unknown,no injury/property damage,0.90,AV contacted fixed roadway/object hazard
30270-13452,0,Heavy Truck,front right,right,no injury/property damage,0.05,Counterpart maneuvered into stationary AV
30270-13449,0,SUV,rear right,front right,no injury/property damage,0.05,Stationary AV struck by moving counterpart
30270-13444,0,Passenger Car,rear,left,no injury/property damage,0.05,Stationary AV struck by moving counterpart
30270-13443,10,Other Fixed Object,bottom,unknown,no injury/property damage,0.90,AV contacted fixed roadway/object hazard
30270-13447,7,"Other, see Narrative",bottom,unknown,no injury/property damage,0.15,Object fell from truck trailer into AV lane
30270-13442,0,Passenger Car,rear right,front right,no injury/property damage,0.05,Stationary AV struck by moving counterpart
30270-13399,0,Passenger Car,rear right,front right,no injury/property damage,0.05,Stationary AV struck by moving counterpart
30270-13388,0,Passenger Car,front,front,minor injury (hosp.),0.05,Stationary AV struck by moving counterpart
30270-13402,0,Passenger Car,rear right,front right,no injury/property damage,0.05,Stationary AV struck by moving counterpart
30270-13396,2,SUV,front,front left,no injury/property damage,0.40,AV turn entry and counterpart passing maneuver both contributed
30270-13407,0,Heavy Truck,rear,left,no injury/property damage,0.05,Stationary AV struck by moving counterpart
30270-13384,0,SUV,rear right,front right,no injury/property damage,0.05,Stationary AV struck by moving counterpart
30270-13371,3,Passenger Car,rear right,front right,no injury/property damage,0.05,Following car struck AV from behind as AV slowed in intersection
13781-11986,18,"Other, see Narrative",right,front right,no injury/property damage,0.50,Redacted narrative with unknown counterpart action while AV proceeding
30270-13372,9,Passenger Car,rear right,front right,minor injury (hosp.),0.20,AV lane-change maneuver to avoid dog preceded rear-end contact
30270-13370,34,Passenger Car,rear left,front,minor injury (hosp.),0.05,Counterpart right turn partially entered AV lane and clipped rear quarter
13781-11375,2,SUV,rear right,front right,minor injury (hosp.),0.40,Redacted narrative; estimate from CP=Making Right Turn and AV=Making Right Turn
30270-13369,2,Passenger Car,rear left,left,no injury/property damage,0.15,Counterpart lane change into AV path
30270-13364,0,Passenger Car,rear right,front right,no injury/property damage,0.00,Passenger car rear-ended AV while AV yielded to crosswalk pedestrian
30270-13363,9,SUV,rear,front,no injury/property damage,0.00,Wrong-way counterpart entered AV lane and struck AV
30270-13365,0,Van,left,right,no injury/property damage,0.00,Passing van mirror struck stationary AV
30610-13376,0,SUV,rear+rear right,front left+front right,no injury/property damage,0.00,AV rear-ended while stationary
30270-13373,22,Passenger Car,right,front right,no injury/property damage,0.05,Vehicle pulling from driveway moved into AV side path
30270-13310,23,Van,rear left,front,no injury/property damage,0.20,Mail truck pulled from curb as AV had just completed lane change
30270-13270,20,Animal,front left,unknown,no injury/property damage,0.40,Domestic animal in lane contact while AV proceeded
30270-13268,24,Passenger Car,rear left,front,no injury/property damage,0.05,Counterpart right turn crossed into AV lane
30270-13276,13,SUV,rear,front left,no injury/property damage,0.05,SUV approached from behind and sideswiped slowing AV
30270-13255,4,Passenger Car,left,rear right,no injury/property damage,0.00,Counterpart reversed into AV after entering on red
30270-13162,0,Heavy Truck,rear right,front right,no injury/property damage,0.00,Heavy truck rear-ended stationary AV
30270-13269,15,Pickup Truck,left,front left,no injury/property damage,1.00,AV initiated left turn from non-turn lane into occupied turn lane
30270-13091,0,"Other, see Narrative",rear right,unknown,no injury/property damage,0.70,"AV moved while tow lift was engaging, causing contact"
30270-13056,0,"Other, see Narrative",unknown,unknown,unknown,0.00,Third-party rear-end collision occurred behind stopped AV
30270-13256,12,Other Fixed Object,front right,unknown,no injury/property damage,0.25,AV contacted fallen utility line after slowing and evasive maneuver
30270-13196,20,Passenger Car,rear left,front,no injury/property damage,0.05,Counterpart hit another vehicle then deflected into AV
30270-13195,0,SUV,rear right,front right,minor injury (hosp.),0.00,Stationary SUV was pushed into stationary AV in chain collision
30270-13189,0,SUV,rear right,front right,no injury/property damage,0.05,Stationary AV struck by moving counterpart
30270-13163,0,Passenger Car,rear right,front right,no injury/property damage,0.00,Passenger car rear-ended stationary AV in queue
30270-13165,0,Passenger Car,rear right,front right,no injury/property damage,0.00,Passenger car rear-ended stationary AV yielding to pedestrian
30270-13164,0,Passenger Car,front,rear left,no injury/property damage,0.00,Counterpart backed into stationary AV
30270-13155,0,Bus,rear,right,no injury/property damage,0.00,Bus completing right turn struck parked AV while passing
30270-13129,0,Passenger Car,rear right,front right,no injury/property damage,0.00,Passenger car rear-ended stationary AV at red light
30270-13090,1,"Other, see Narrative",front right,unknown,no injury/property damage,0.25,AV proceeded as gate was opening into travel path
30270-13088,2,SUV,rear,front left,no injury/property damage,0.00,Following SUV struck AV rear during turn-start stop-and-go
30270-13328,7,SUV,rear,front left,no injury/property damage,0.20,Counterpart passed during AV right turn; mostly counterpart fault
30270-13254,0,Bus,front right,rear right,no injury/property damage,0.00,Counterpart backed into stationary AV
30270-13251,2,Passenger Car,rear right,front right,no injury/property damage,0.05,Following car rear-ended AV as AV slowed for pedestrians
30270-13250,0,Heavy Truck,front right,rear left,no injury/property damage,0.00,Counterpart backed into stationary AV
30270-13275,0,Passenger Car,rear,front left,no injury/property damage,0.00,Passenger car passing from behind struck stationary curbside AV
30270-13236,0,SUV,rear right,front right,no injury/property damage,0.00,SUV rear-ended stationary AV in queue
30270-13235,0,Van,rear right,front right,no injury/property damage,0.00,Van turning from behind struck stationary AV at stop
30270-13206,0,Heavy Truck,rear,rear,no injury/property damage,0.00,Oncoming heavy truck sideswiped stationary AV while passing narrow segment
30270-13274,0,SUV,rear,right,no injury/property damage,0.00,Passing SUV struck stationary AV while maneuvering around queue
30270-13247,0,Passenger Car,front right,rear right,no injury/property damage,0.00,Counterpart backed into stationary AV
30270-13205,0,SUV,rear,right,no injury/property damage,0.00,Open AV passenger door was struck by passing SUV
30270-13204,0,SUV,rear right,front left,no injury/property damage,0.05,Counterpart maneuvered into stationary AV
30270-13135,0,Heavy Truck,rear left,right,no injury/property damage,0.05,Reversing trailer contact with AV after AV repositioned in lot
30270-13199,0,Pickup Truck,rear,front left,no injury/property damage,0.20,AV stopped straddling lanes and was struck by following pickup
30270-13312,0,SUV,front left,left,no injury/property damage,0.05,Stationary AV struck by moving counterpart
30270-13311,0,SUV,left,rear right,no injury/property damage,0.05,Reversing SUV from stall struck AV after AV yielded then stopped
30270-13201,0,First Responder Vehicle,front right,rear right,no injury/property damage,0.00,Counterpart backed into stationary AV
30270-13102,9,Passenger Car,rear right,front right,no injury/property damage,0.30,Both vehicles proceeding straight; likely sideswipe/merge conflict
30270-13095,30,"Other, see Narrative",front right,unknown,no injury/property damage,0.15,Object originated from another vehicle
30270-13238,0,Passenger Car,front right,rear right,no injury/property damage,0.00,Counterpart backed into stationary AV
30270-13085,33,Passenger Car,left,front right,no injury/property damage,0.10,Counterpart failed to yield / encroached
30270-13066,0,Bus,rear,right,no injury/property damage,0.00,Passing bus struck stationary AV while AV yielded in queue
30270-13082,0,Bus,front,right,no injury/property damage,0.10,Bus and AV stop-go interaction with bus side contact into stationary AV
30270-13084,2,SUV,front,right,no injury/property damage,0.35,AV pulled from curb while SUV was passing and moving toward curb; shared conflict
30270-13099,0,Passenger Car,rear right,front right,no injury/property damage,0.00,Counterpart failed to yield to stationary AV
30270-13325,9,"Other, see Narrative",bottom,unknown,no injury/property damage,1.00,AV struck raised roadway/sidewalk while turning
30270-13326,0,Pickup Truck,rear,right,no injury/property damage,0.05,Stationary AV struck by moving counterpart
30270-13324,0,Heavy Truck,left,right,no injury/property damage,0.05,Stationary AV struck by moving counterpart
30270-13320,0,Passenger Car,rear,front left,no injury/property damage,0.05,Counterpart maneuvered into stationary AV
30270-13301,0,Passenger Car,rear,left,no injury/property damage,0.05,Stationary AV struck by moving counterpart
30270-13303,0,SUV,rear right,front left,no injury/property damage,0.00,Chain-reaction crash pushed stopped SUV into stopped AV
30270-13302,0,First Responder Vehicle,rear left,right,no injury/property damage,0.05,Counterpart maneuvered into stationary AV
30270-13300,0,Heavy Truck,left,right,no injury/property damage,0.00,Truck trailer encroached and struck stopped AV
30270-13287,0,Pickup Truck,rear right,front right,minor injury (hosp.),0.00,Pickup rear-ended stopped AV
30270-13278,0,Heavy Truck,front,rear left,no injury/property damage,0.00,Counterpart backed into stationary AV
30270-13277,0,"Other, see Narrative",front right,rear right,no injury/property damage,0.00,Counterpart backed into stationary AV
30270-13267,6,"Other, see Narrative",right,rear right,no injury/property damage,0.10,Counterpart backing maneuver caused collision
30270-13246,1,Other Fixed Object,front left,unknown,no injury/property damage,1.00,AV maneuvered into bollard while reversing
30270-13244,0,Passenger Car,rear right,front right,minor injury (hosp.),0.00,Passenger car rear-ended stopped AV
30270-13243,0,Bus,rear,right,no injury/property damage,0.00,Bus side-swiped stopped AV during pass
30270-13242,0,Bus,rear,right,no injury/property damage,0.00,Bus passing on left struck stopped AV
30270-13241,0,Bus,left,right,no injury/property damage,0.00,Bus in adjacent turn lane struck AV waiting at red
30270-13240,23,Passenger Car,rear left,front,no injury/property damage,0.05,Passenger car changed lanes into AV path
13781-13237,0,"Other, see Narrative",rear left+rear right,front right,no injury/property damage,0.05,Redacted narrative; estimate from CP=Making Right Turn and AV=Stopped
30270-13239,1,Passenger Car,rear right,front right,no injury/property damage,0.20,Rear vehicle hit AV during low-speed left-turn initiation; mostly rear-vehicle fault
30270-13202,7,SUV,rear left,rear,no injury/property damage,0.10,Counterpart backing maneuver caused collision
30270-13194,0,Passenger Car,left,right,no injury/property damage,0.00,Passing car side-swiped parked AV
30270-13197,0,Passenger Car,rear right,front right,no injury/property damage,0.00,Passenger car rear-ended stopped AV in queue
30270-13193,39,"Other, see Narrative",bottom,unknown,no injury/property damage,0.80,AV struck fallen street sign in lane at speed
30270-13192,0,Passenger Car,rear,front left,minor injury (hosp.),0.00,Speeding passenger car maneuvered into stopped AV
30270-13190,0,Passenger Car,rear right,front right,minor injury (hosp.),0.00,Passenger car rear-ended stopped AV
30270-13198,0,Passenger Car,rear right,front right,unknown,0.00,Passenger car rear-ended stopped AV
30270-13167,2,Passenger Car,rear right,front right,unknown,0.05,Rear vehicle struck AV while AV was slowly yielding at stop sign
30270-13161,4,Non-Motorist: Pedestrian,rear left,unknown,moderate injury (hosp.),0.00,Passenger exited moving vehicle; AV continued rolling onto foot
30270-13148,0,Passenger Car,rear right,front right,no injury/property damage,0.00,Passenger car rear-ended stopped AV at light
30270-13159,0,Heavy Truck,front right,rear right,no injury/property damage,0.00,Counterpart backed into stationary AV
30270-13160,8,"Other, see Narrative",bottom,unknown,no injury/property damage,1.00,AV undercarriage struck pavement at parking-lot entrance
30270-13137,0,Passenger Car,rear right,front right,no injury/property damage,0.00,Passenger car rear-ended AV stopped for pedestrian
30270-13133,1,Heavy Truck,rear right,front right,no injury/property damage,0.30,Both vehicles proceeding straight; likely sideswipe/merge conflict
30270-13144,0,Pickup Truck,rear,front left,no injury/property damage,0.00,Pickup struck parked AV from behind
30270-13130,0,Passenger Car,rear right,front right,no injury/property damage,0.00,Chain-reaction impact pushed stopped passenger car into stopped AV
30270-13128,0,Passenger Car,rear right,front right,no injury/property damage,0.00,Passenger car rear-ended parked AV
30270-13127,0,Heavy Truck,rear,rear,no injury/property damage,0.00,Passing truck trailer clipped stopped AV
30270-13126,0,Heavy Truck,front,rear,no injury/property damage,0.00,Turning truck trailer struck AV stopped to yield
30270-13100,0,Van,rear right,front right,minor injury (hosp.),0.00,Mail truck rear-ended stopped AV
30270-11849,0,SUV,rear,front right,unknown,0.00,SUV struck parked AV during curbside drop-off
30270-11887,7,SUV,rear,right,no injury/property damage,0.00,SUV passenger opened door into passing AV; passenger at fault
30270-11933,40,SUV,right,front,no injury/property damage,0.15,Counterpart lane change into AV path
30270-11865,0,Heavy Truck,rear,front left,no injury/property damage,0.00,Counterpart backed into stationary AV
30270-13092,0,Passenger Car,rear right,front right,no injury/property damage,0.00,Chain-reaction rear-end pushed car into stopped AV
30270-13096,30,"Other, see Narrative",front,unknown,no injury/property damage,0.80,AV continued into visibly low suspended wire across roadway
30270-12070,5,Animal,rear left,unknown,no injury/property damage,0.70,AV departed with cat under vehicle and ran over it
30270-13028,0,Passenger Car,front left,rear,no injury/property damage,0.00,Counterpart backed into stationary AV
30270-12063,0,Passenger Car,rear,right,no injury/property damage,0.00,Lane-changing passenger car sideswiped stopped AV
30270-12062,1,Passenger Car,rear,front left,no injury/property damage,0.05,Passing car clipped AV as AV slowed with signal for pickup
30270-12042,0,Heavy Truck,front right,rear right,no injury/property damage,0.00,Counterpart backed into stationary AV
30270-12008,0,Passenger Car,front right,rear right,no injury/property damage,0.00,Counterpart backed into stationary AV
30270-11949,0,SUV,front right,rear right,no injury/property damage,0.00,Counterpart backed into stationary AV
30270-11957,0,Heavy Truck,front,front left,no injury/property damage,0.45,AV stopped straddling lanes during lane change and was struck by advancing truck
30270-11955,0,Van,rear,rear,no injury/property damage,0.00,Van passing on narrow road clipped stopped AV
