reportID,speed,crashwith,svhit,cphit,severity,faultfrac,reasoning
30270-11422,7,"Other, see Narrative",bottom,unknown,no injury/property damage,0.60,AV struck roadway object in lane
30270-11415,0,Pickup Truck,rear right,front right,no injury/property damage,0.00,Pickup rear-ended stopped AV at red
30270-11379,7,Other Fixed Object,front right+bottom,unknown,no injury/property damage,1.00,AV entered driveway and struck concrete/chain obstacle
30270-11381,22,Passenger Car,rear,front,no injury/property damage,0.05,Oncoming car made unprotected left into AV lane
30270-11467,2,Other Fixed Object,front right,unknown,no injury/property damage,1.00,AV drove into closed barrier arm
30270-11412,0,Passenger Car,left,left,no injury/property damage,0.00,Turning passenger car crossed center line into stationary AV
30270-11404,0,Passenger Car,rear,right,no injury/property damage,0.00,Turning passenger car clipped parked AV after drop-off
30270-11418,0,SUV,front right,rear right,no injury/property damage,0.00,Counterpart backed into stationary AV
30270-11361,4,"Other, see Narrative",front right,unknown,unknown,0.00,Detached object from oncoming pickup rolled into AV lane
30270-11371,1,Passenger Car,rear right,front right,no injury/property damage,0.10,Following car rear-ended AV while AV slowed to yield pedestrian
30270-11402,0,Passenger Car,rear right,front right,no injury/property damage,0.00,Passenger car rear-ended AV stopped for red turn arrow
30270-11374,0,Passenger Car,front right,right,no injury/property damage,0.05,Cross-traffic red-light violator struck AV after AV stopped to yield
30270-11365,0,Passenger Car,rear right,front right,no injury/property damage,0.10,AV stop-and-go at beacon preceded rear-end by following car
30270-11358,0,First Responder Vehicle,rear,left,no injury/property damage,0.00,Fire truck passing narrow lane struck stopped AV
30270-11401,0,SUV,rear right,front right,no injury/property damage,0.00,SUV rear-ended AV stopped at stop sign
30270-11362,0,Passenger Car,front right,rear right,no injury/property damage,0.00,Counterpart backed into stationary AV
30270-11360,5,Passenger Car,rear right,front right,no injury/property damage,0.10,Passenger car rear-ended AV as AV slowed behind stopped bus
30270-11333,0,Bus,rear,rear,no injury/property damage,0.00,Turning bus clipped stopped AV on narrow street
30270-11344,0,Bus,rear,right,no injury/property damage,0.00,Passing bus struck parked curbside AV
30270-11328,0,Heavy Truck,rear right,front right,minor injury (hosp.),0.10,AV stop-and-go then stop preceded rear-end by following truck
30270-11334,4,Other Fixed Object,bottom,unknown,no injury/property damage,1.00,AV U-turn maneuver struck raised median pavement
30270-11500,13,"Other, see Narrative",front,unknown,no injury/property damage,0.80,AV followed construction path into removed-pavement drop
30270-11495,0,Bus,rear,right,no injury/property damage,0.00,AV passenger opened door into passing bus
30270-11475,0,Van,rear right,front right,minor injury (hosp.),0.00,Minivan rear-ended AV stopped at red
30610-11497,0,SUV,rear left,front,no injury/property damage,0.10,Counterpart backing maneuver caused collision
30270-11490,0,Passenger Car,rear,front left,no injury/property damage,0.00,Chain-reaction impact pushed passenger car into parked AV
30270-11474,0,SUV,rear left,front,no injury/property damage,0.00,SUV rear-ended AV stopped at red
30270-11476,24,Passenger Car,rear,front left,minor injury (hosp.),0.00,Counterpart struck AV from behind while overtaking
30270-11469,0,Bus,rear,left,no injury/property damage,0.45,AV and bus both repositioned in intersection before bus turn contact
30270-11456,0,Motorcycle,rear left,front right,no injury/property damage,0.00,Motorcycle lane change into leftmost lane struck parked AV
30270-11433,0,Heavy Truck,rear,left,minor injury (hosp.),0.00,Turning heavy truck struck AV that had reversed and stopped to yield
30270-11450,0,SUV,left+front,left+front,moderate injury (hosp.),0.00,Wrong-way SUV struck parked AV head-on
13781-11459,8,Other Fixed Object,front right,unknown,minor injury (hosp.),0.80,Redacted narrative; estimate from fixed-object contact with AV in nonstandard maneuver
30270-11432,3,Heavy Truck,left,right,no injury/property damage,0.25,Truck turned right from incorrect lane during parallel right-turn
30270-11430,0,Passenger Car,rear right,front right,no injury/property damage,0.00,Passenger car rear-ended AV stopped for queue
30270-11424,5,SUV,front,right,no injury/property damage,0.70,AV pulled forward while adjacent AV was reversing from stall
30270-11413,0,Heavy Truck,rear left,front,no injury/property damage,0.00,Box truck struck parked in-lane AV near construction
30270-11417,12,Passenger Car,front left,front left,no injury/property damage,0.00,Counterpart traveling wrong way
30270-11420,0,Bus,left,right,no injury/property damage,0.00,Bus with open compartment door struck stopped AV mirror
30270-11400,0,Passenger Car,rear right,front right,no injury/property damage,0.00,Passenger car rear-ended AV stopped in queue
30270-11383,23,Passenger Car,front,right,no injury/property damage,0.05,Passenger car changed lanes into AV side
30270-11384,0,SUV,rear,right,no injury/property damage,0.00,Passing SUV struck stopped AV rear quarter
30270-11378,0,Pickup Truck,rear right,front right,no injury/property damage,0.00,Chain-reaction pickup impact then rear-ended stopped AV
30270-11373,0,Heavy Truck,rear,right,no injury/property damage,0.00,Passing heavy truck bed clipped parked AV
30270-11372,2,Passenger Car,rear right,front right,no injury/property damage,0.10,Passenger car rear-ended AV while AV slowed for queue
30270-11370,1,Passenger Car,rear right,front right,no injury/property damage,0.10,Following car rear-ended AV during stop-and-go turn-lane traffic
30270-11330,0,Pickup Truck,rear,right,no injury/property damage,0.00,Pickup passing parked in-lane AV clipped rear quarter
30270-11329,0,Bus,rear,right,no injury/property damage,0.00,Bus passing around parked AV clipped rear side
30270-11323,16,Passenger Car,rear right,front right,minor injury (hosp.),0.10,Passenger car rear-ended AV while AV slowed for queue
30270-11302,11,Passenger Car,rear,front right,no injury/property damage,0.25,Parallel left-turn conflict with following car contacting AV rear quarter
30270-11295,1,Other Fixed Object,front right,unknown,no injury/property damage,0.80,Barrier arm reclosed as AV proceeded through exit
30270-11291,5,Heavy Truck,left,right,no injury/property damage,0.05,Heavy truck turned right from adjacent lane across AV path
30270-11220,23,"Other, see Narrative",front right+bottom,unknown,no injury/property damage,0.70,AV struck unattended bicycle lying in travel lane
30270-11214,15,Passenger Car,rear right,front right,no injury/property damage,0.10,Passenger car rear-ended AV while AV slowed for queue
30270-11213,0,Bus,left,right,no injury/property damage,0.00,AV passenger opened rear door into passing bus
30270-11163,0,Van,rear,right,no injury/property damage,0.00,Turning van passed and struck parked AV in loading zone
30270-11297,5,"Other, see Narrative",front right+bottom,unknown,no injury/property damage,1.00,AV turned into parking-lot entrance chain
30270-11298,0,Heavy Truck,left,left,no injury/property damage,0.00,Passing heavy truck struck stopped AV on narrow street
30270-11250,0,Van,rear,right,no injury/property damage,0.00,Turning minivan passing parked AV clipped rear quarter
30270-11239,7,"Other, see Narrative",front right,unknown,no injury/property damage,1.00,AV turned into parking-lot chain
30270-11221,8,Pickup Truck,left,rear right,no injury/property damage,0.10,Counterpart backing maneuver caused collision
30270-11195,6,"Other, see Narrative",front right,unknown,no injury/property damage,0.80,AV struck fallen utility line hanging across roadway
30270-11225,21,Passenger Car,right,front right,no injury/property damage,0.05,Passenger car entered roadway from driveway into AV side
30270-11219,0,Heavy Truck,rear,left,minor injury (hosp.),0.00,Passing heavy truck struck stopped AV on narrow segment
30270-11194,0,SUV,rear,right,no injury/property damage,0.00,SUV passing stopped AV clipped rear quarter
30270-11276,0,SUV,rear,rear right,no injury/property damage,0.00,Counterpart backed into stationary AV
30270-11177,0,SUV,rear right,front right,no injury/property damage,0.00,SUV rear-ended stopped AV at red
30270-11175,0,SUV,rear right,front right,no injury/property damage,0.00,SUV rear-ended AV stopped to yield blocked lane
30270-11167,0,Passenger Car,front right,rear right,no injury/property damage,0.00,Counterpart backed into stationary AV
30270-11275,39,"Other, see Narrative",front left+bottom,unknown,no injury/property damage,0.80,AV struck unattended bicycle lying in roadway at speed
30270-11196,9,Pickup Truck,front left,front,no injury/property damage,0.05,Pickup entered from alley into AV lane
30270-11216,0,Passenger Car,rear,right,no injury/property damage,0.00,Passing car with open door struck parked AV
30270-11193,2,Other Fixed Object,front right,unknown,no injury/property damage,1.00,AV struck parking-lot chain
30270-11160,0,Passenger Car,rear right,front right,no injury/property damage,0.00,Passenger car rear-ended AV stopped at red
30270-11212,0,SUV,rear right,front right,minor injury (hosp.),0.00,SUV rear-ended AV stopped in queue
30270-11170,0,Passenger Car,front right,rear right,no injury/property damage,0.00,Counterpart backed into stationary AV
30270-11173,0,Pickup Truck,right+front right,rear right+front right,no injury/property damage,0.00,Pickup repeatedly struck stationary AV front and rear
30270-11210,0,Passenger Car,rear,right,no injury/property damage,0.00,Lane-changing passenger car sideswiped stopped AV
30270-11172,22,SUV,left,front left,no injury/property damage,0.05,SUV turned right across AV lane while AV was passing
30270-11208,0,SUV,rear right,front right,no injury/property damage,0.00,SUV rear-ended AV stopped at red
30270-11162,0,SUV,rear,front,no injury/property damage,0.05,SUV attempted pass maneuver around stopped AV and clipped rear quarter
30270-11207,0,Passenger Car,left,right,no injury/property damage,0.00,AV passenger opened rear door into passing car
30270-11161,2,"Other, see Narrative",front,unknown,no injury/property damage,1.00,AV reversing multi-point maneuver struck trailer hitch
30270-11171,0,Van,rear,right,no injury/property damage,0.00,AV passenger opened rear door into passing van
30270-11206,21,"Other, see Narrative",front right,unknown,no injury/property damage,0.00,Tires fell from trailer ahead and rolled into AV path
30270-11284,0,SUV,rear right,front left,no injury/property damage,0.00,Turning SUV struck stationary AV at red
30270-11281,0,Bus,left,right,no injury/property damage,0.00,AV passenger opened rear door into passing bus
30270-11282,0,Bus,left,right,no injury/property damage,0.00,Passing bus struck stopped AV in right-turn lane
30270-11280,0,Passenger Car,rear right,front right,minor injury (hosp.),0.10,AV stop-and-go for emergency vehicle preceded rear-end by following car
30270-11279,1,Passenger Car,rear left,front left,no injury/property damage,0.10,Following passenger car clipped AV rear while AV slowed to yield merge
30270-11273,0,Heavy Truck,front,rear left,minor injury (hosp.),0.00,Heavy truck parking maneuver struck stationary curbside AV
30270-11247,0,Heavy Truck,rear,left,no injury/property damage,0.00,Passing box truck struck stopped AV on narrow street
30270-11249,0,Pickup Truck,rear,right,no injury/property damage,0.20,AV reversed and stopped in lane before passing truck clipped AV
30270-11246,10,Pickup Truck,left,front left,no injury/property damage,0.05,Inner-lane pickup crossed turn-lane boundary into AV
30270-11245,0,SUV,rear right,front right,minor injury (hosp.),0.05,Stationary AV struck by moving counterpart
30270-11238,0,Passenger Car,rear left,front,no injury/property damage,0.00,Lane-changing passenger car sideswiped stopped AV
30270-11244,8,SUV,front,front right,no injury/property damage,0.05,SUV left turn crossed centerline into AV path
30270-11224,6,SUV,front left+right,left,no injury/property damage,0.00,AV passenger repeatedly opened door while AV moved past stopped AV
30270-11218,0,Bus,left,front left,no injury/property damage,0.00,AV passenger opened rear door into passing bus
30270-11192,0,Passenger Car,rear,front right,minor injury (hosp.),0.00,Passenger car pulled out from parking position into stopped AV
30270-11204,0,Van,front,front right,no injury/property damage,0.00,Van departed roadway/sidewalk and struck stationary AV
30270-11190,0,Passenger Car,rear right,front right,no injury/property damage,0.00,Passenger car rear-ended stopped AV at red
30270-11209,10,Other Fixed Object,bottom,unknown,no injury/property damage,1.00,AV underbody struck elevated gate track
30270-11205,0,Non-Motorist: Cyclist,right,unknown,minor injury (hosp.),0.00,AV passenger opened front door into passing cyclist
30270-11189,0,Heavy Truck,rear,left,no injury/property damage,0.00,Passing heavy truck struck stopped AV on narrow street
30270-11174,10,Other Fixed Object,bottom,unknown,no injury/property damage,1.00,AV underbody struck elevated gate track
30270-11146,31,"Other, see Narrative",front+bottom,unknown,no injury/property damage,0.40,AV struck debris displaced across lane by vehicle ahead
30270-11087,0,Passenger Car,rear,front,no injury/property damage,0.00,AV stopped; struck by other vehicle proceeding straight
30270-11085,0,SUV,rear passenger side,front driver side,no injury/property damage,0.00,AV stopped; struck by SUV proceeding straight
30270-11016,0,Non-Motorist: Other,rear passenger door,unknown,moderate,0.00,AV stopped; non-motorist contact
30270-11014,0,Non-Motorist: Other,rear driver side,unknown,no injury/property damage,0.00,AV stopped; non-motorist contact; redacted narrative
30270-11088,9,Other Fixed Object,bottom,top,no injury/property damage,0.90,AV struck fixed object while turning in parking lot
30610-11096,1,SUV,rear,front,no injury/property damage,0.30,AV encountered traffic cones and contacted SUV at low speed
30270-10977,18,Non-Motorist: Other,rear driver side,unknown,no injury/property damage,0.35,AV proceeding at 18mph; struck non-motorist crossing roadway; redacted
30270-11046,0,Passenger Car,rear passenger door,driver side,no injury/property damage,0.00,AV parked; struck by passing vehicle
30270-11015,0,Pickup Truck,rear driver side,front passenger side,no injury/property damage,0.00,AV parked; struck by pickup changing lanes
30270-11044,1,Non-Motorist: Cyclist,right rear corner,unknown,no injury/property damage,0.70,AV changing lanes at low speed; struck cyclist
30270-11013,2,Passenger Car,rear,front,no injury/property damage,0.25,Both proceeding straight at low speed; limited info from metadata
30270-10998,0,Pickup Truck,rear driver side,front passenger side,no injury/property damage,0.00,AV parked; struck by pickup proceeding straight
